{
  "hand_id": "apl_2024_hand_0003",
  "tournament_id": "apl_2024",
  "hand_number": 3,
  "timestamp": "2024-11-27T00:00:00Z",
  "duration_seconds": 453,
  "description": "Liv Boeree makes an insane preflop call with bottom pair against Justin Bonomo's value bet. After Justin Bonomo bets 16.7bb into a 33.6bb pot on the preflop, Liv Boeree tanks for 167s and makes the hero call with bottom pair. Justin Bonomo shows middle pair and Liv Boeree wins a massive 50.3bb pot.",
  "hero_name": "Liv Boeree",
  "villain_name": "Justin Bonomo",
  "hero_position": "UTG",
  "villain_position": "MP",
  "hero_stack_bb": 472.9,
  "villain_stack_bb": 199.6,
  "street": "PREFLOP",
  "pot_bb": 50.3,
  "action_sequence": [
    "check",
    "bet",
    "call"
  ],
  "hero_action": "fold",
  "result": "LOSE",
  "tags": [
    "CONTINUATION_BET",
    "RIVER_DECISION",
    "SHORT_STACK",
    "VALUE_BET"
  ],
  "hand_type": "VALUE_BET",
  "video_url": "gs://poker-videos-prod/apl_2024/day7_table8.mp4",
  "video_start_time": 8334.6,
  "video_end_time": 11765.0,
  "thumbnail_url": "gs://poker-videos-prod/thumbnails/apl_2024_hand_0003.jpg",
  "ati_version": "1.0.0",
  "ati_confidence": 0.86
}