{
  "hand_id": "triton_poker_2024_hand_0087",
  "tournament_id": "triton_poker_2024",
  "hand_number": 87,
  "timestamp": "2024-02-02T00:00:00Z",
  "duration_seconds": 84,
  "description": "Stephen Chidwick makes an insane turn call with two pair against Mikki Mase's value bet. After Mikki Mase bets 523.4bb into a 253.8bb pot on the turn, Stephen Chidwick tanks for 197s and makes the hero call with two pair. Mikki Mase shows full house and Stephen Chidwick wins a massive 777.2bb pot.",
  "hero_name": "Stephen Chidwick",
  "villain_name": "Mikki Mase",
  "hero_position": "UTG1",
  "villain_position": "BB",
  "hero_stack_bb": 345.2,
  "villain_stack_bb": 107.8,
  "street": "TURN",
  "pot_bb": 777.2,
  "action_sequence": [
    "check",
    "bet",
    "call"
  ],
  "hero_action": "call",
  "result": "LOSE",
  "tags": [
    "TILT",
    "TRAP",
    "SLOW_PLAY"
  ],
  "hand_type": "SLOW_PLAY",
  "video_url": "gs://poker-videos-prod/triton_poker_2024/day3_table7.mp4",
  "video_start_time": 3449.9,
  "video_end_time": 12706.6,
  "thumbnail_url": "gs://poker-videos-prod/thumbnails/triton_poker_2024_hand_0087.jpg",
  "ati_version": "1.0.0",
  "ati_confidence": 0.94
}