{
  "hand_id": "mpp_2024_hand_0027",
  "tournament_id": "mpp_2024",
  "hand_number": 27,
  "timestamp": "2024-12-15T00:00:00Z",
  "duration_seconds": 422,
  "description": "Andrew Robl triple barrels against Vanessa Kade with queen-high. On the turn, Andrew Robl shoves 75.6bb. Vanessa Kade thinks for 193s and folds two pair. Andrew Robl takes down a 195.4bb pot with pure air.",
  "hero_name": "Andrew Robl",
  "villain_name": "Vanessa Kade",
  "hero_position": "UTG",
  "villain_position": "BTN",
  "hero_stack_bb": 183.8,
  "villain_stack_bb": 400.3,
  "street": "TURN",
  "pot_bb": 195.4,
  "action_sequence": [
    "raise 2.5bb",
    "call",
    "check",
    "bet 0.5pot",
    "call",
    "check",
    "bet 0.75pot",
    "call",
    "check",
    "all-in",
    "fold"
  ],
  "hero_action": "fold",
  "result": "SPLIT",
  "tags": [
    "BAD_BEAT",
    "HIGH_STAKES",
    "SHORT_STACK",
    "RIVER_DECISION",
    "BLUFF"
  ],
  "hand_type": "BLUFF",
  "video_url": "gs://poker-videos-prod/mpp_2024/day4_table19.mp4",
  "video_start_time": 9985.5,
  "video_end_time": 13681.2,
  "thumbnail_url": "gs://poker-videos-prod/thumbnails/mpp_2024_hand_0027.jpg",
  "ati_version": "1.0.0",
  "ati_confidence": 0.76
}