{
  "hand_id": "hustler_casino_live_2024_hand_0053",
  "tournament_id": "hustler_casino_live_2024",
  "hand_number": 53,
  "timestamp": "2024-08-16T00:00:00Z",
  "duration_seconds": 208,
  "description": "Kristen Bicknell triple barrels against Eric Persson with trips. On the flop, Kristen Bicknell shoves 144.9bb. Eric Persson thinks for 177s and folds ace-high. Kristen Bicknell takes down a 360.9bb pot with pure air.",
  "hero_name": "Kristen Bicknell",
  "villain_name": "Eric Persson",
  "hero_position": "MP",
  "villain_position": "UTG1",
  "hero_stack_bb": 369.8,
  "villain_stack_bb": 421.8,
  "street": "FLOP",
  "pot_bb": 360.9,
  "action_sequence": [
    "raise 3bb",
    "call",
    "bet 0.33pot",
    "call",
    "bet 0.5pot",
    "call",
    "all-in",
    "tank 120s",
    "fold"
  ],
  "hero_action": "call",
  "result": "SPLIT",
  "tags": [
    "CONTINUATION_BET",
    "HIGH_STAKES",
    "SHORT_STACK",
    "RIVER_DECISION",
    "DONK_BET",
    "BLUFF"
  ],
  "hand_type": "BLUFF",
  "video_url": "gs://poker-videos-prod/hustler_casino_live_2024/day9_table7.mp4",
  "video_start_time": 2131.2,
  "video_end_time": 11932.3,
  "thumbnail_url": "gs://poker-videos-prod/thumbnails/hustler_casino_live_2024_hand_0053.jpg",
  "ati_version": "1.0.0",
  "ati_confidence": 0.86
}