{
  "hand_id": "mpp_2023_hand_0006",
  "tournament_id": "mpp_2023",
  "hand_number": 6,
  "timestamp": "2024-09-22T00:00:00Z",
  "duration_seconds": 406,
  "description": "Tom Dwan makes a sick river call against Junglemann. Junglemann fires two barrels and shoves 269.0bb on the river. Tom Dwan thinks for 104s and calls with just bottom pair. Junglemann was bluffing with middle pair and Tom Dwan scoops a 660.1bb pot.",
  "hero_name": "Tom Dwan",
  "villain_name": "Junglemann",
  "hero_position": "BB",
  "villain_position": "CO",
  "hero_stack_bb": 458.0,
  "villain_stack_bb": 496.7,
  "street": "RIVER",
  "pot_bb": 660.1,
  "action_sequence": [
    "check",
    "bet",
    "call"
  ],
  "hero_action": "fold",
  "result": "LOSE",
  "tags": [
    "TRAP",
    "SHORT_STACK",
    "SLOW_PLAY",
    "DEEP_STACK",
    "CHECK_RAISE"
  ],
  "hand_type": "SLOW_PLAY",
  "video_url": "gs://poker-videos-prod/mpp_2023/day9_table1.mp4",
  "video_start_time": 6401.5,
  "video_end_time": 19267.2,
  "thumbnail_url": "gs://poker-videos-prod/thumbnails/mpp_2023_hand_0006.jpg",
  "ati_version": "1.0.0",
  "ati_confidence": 0.85
}