{
  "hand_id": "apl_2024_hand_0062",
  "tournament_id": "apl_2024",
  "hand_number": 62,
  "timestamp": "2024-04-21T00:00:00Z",
  "duration_seconds": 188,
  "description": "Maria Ho makes a sick turn call against Bryn Kenney. Bryn Kenney fires three barrels and shoves 353.7bb on the turn. Maria Ho thinks for 234s and calls with just top pair. Bryn Kenney was bluffing with ace-high bluff and Maria Ho scoops a 547.4bb pot.",
  "hero_name": "Maria Ho",
  "villain_name": "Bryn Kenney",
  "hero_position": "BTN",
  "villain_position": "UTG",
  "hero_stack_bb": 287.1,
  "villain_stack_bb": 462.9,
  "street": "TURN",
  "pot_bb": 547.4,
  "action_sequence": [
    "raise 3bb",
    "3bet 9bb",
    "call",
    "check",
    "bet 0.5pot",
    "call",
    "check",
    "bet 0.75pot",
    "call",
    "check",
    "all-in",
    "tank 240s",
    "call"
  ],
  "hero_action": "fold",
  "result": "SPLIT",
  "tags": [
    "SICK_CALL",
    "HERO_CALL",
    "RIVER_DECISION",
    "SQUEEZE",
    "3BET"
  ],
  "hand_type": "HERO_CALL",
  "video_url": "gs://poker-videos-prod/apl_2024/day9_table13.mp4",
  "video_start_time": 4106.3,
  "video_end_time": 13479.3,
  "thumbnail_url": "gs://poker-videos-prod/thumbnails/apl_2024_hand_0062.jpg",
  "ati_version": "1.0.0",
  "ati_confidence": 0.81
}