{
  "hand_id": "hustler_casino_live_2024_hand_0096",
  "tournament_id": "hustler_casino_live_2024",
  "hand_number": 96,
  "timestamp": "2024-02-14T00:00:00Z",
  "duration_seconds": 163,
  "description": "Andrew Robl triple barrels against Phil Hellmuth with flush. On the river, Andrew Robl shoves 57.1bb. Phil Hellmuth thinks for 138s and folds ace-high. Andrew Robl takes down a 119.6bb pot with pure air.",
  "hero_name": "Andrew Robl",
  "villain_name": "Phil Hellmuth",
  "hero_position": "UTG",
  "villain_position": "BB",
  "hero_stack_bb": 314.2,
  "villain_stack_bb": 403.4,
  "street": "RIVER",
  "pot_bb": 119.6,
  "action_sequence": [
    "raise 2.5bb",
    "call",
    "check",
    "bet 0.5pot",
    "call",
    "check",
    "bet 0.75pot",
    "call",
    "check",
    "all-in",
    "fold"
  ],
  "hero_action": "call",
  "result": "SPLIT",
  "tags": [
    "HIGH_STAKES",
    "COOLER",
    "RIVER_DECISION",
    "3BET",
    "BLUFF"
  ],
  "hand_type": "BLUFF",
  "video_url": "gs://poker-videos-prod/hustler_casino_live_2024/day5_table14.mp4",
  "video_start_time": 941.4,
  "video_end_time": 11993.2,
  "thumbnail_url": "gs://poker-videos-prod/thumbnails/hustler_casino_live_2024_hand_0096.jpg",
  "ati_version": "1.0.0",
  "ati_confidence": 0.8
}