{
  "hand_id": "mpp_2023_hand_0099",
  "tournament_id": "mpp_2023",
  "hand_number": 99,
  "timestamp": "2024-05-14T00:00:00Z",
  "duration_seconds": 315,
  "description": "Stephen Chidwick goes all-in for 382.4bb on the preflop against Junglemann. Junglemann has queen-high and calls. Villain wins and Junglemann wins a 638.4bb pot.",
  "hero_name": "Stephen Chidwick",
  "villain_name": "Junglemann",
  "hero_position": "SB",
  "villain_position": "CO",
  "hero_stack_bb": 370.4,
  "villain_stack_bb": 189.8,
  "street": "PREFLOP",
  "pot_bb": 638.4,
  "action_sequence": [
    "limp",
    "raise 5bb",
    "call",
    "check",
    "bet 0.5pot",
    "raise 2x",
    "all-in",
    "call"
  ],
  "hero_action": "call",
  "result": "LOSE",
  "tags": [
    "HIGH_STAKES",
    "ALL_IN",
    "SHORT_STACK"
  ],
  "hand_type": "ALL_IN",
  "video_url": "gs://poker-videos-prod/mpp_2023/day1_table4.mp4",
  "video_start_time": 8289.7,
  "video_end_time": 11263.0,
  "thumbnail_url": "gs://poker-videos-prod/thumbnails/mpp_2023_hand_0099.jpg",
  "ati_version": "1.0.0",
  "ati_confidence": 0.94
}