{
  "hand_id": "wsop_2024_hand_0051",
  "tournament_id": "wsop_2024",
  "hand_number": 51,
  "timestamp": "2024-11-22T00:00:00Z",
  "duration_seconds": 529,
  "description": "Mikki Mase triple barrels against Alex Foxen with top pair. On the river, Mikki Mase shoves 213.8bb. Alex Foxen thinks for 241s and folds queen-high. Mikki Mase takes down a 676.0bb pot with pure air.",
  "hero_name": "Mikki Mase",
  "villain_name": "Alex Foxen",
  "hero_position": "CO",
  "villain_position": "UTG1",
  "hero_stack_bb": 330.6,
  "villain_stack_bb": 176.4,
  "street": "RIVER",
  "pot_bb": 676.0,
  "action_sequence": [
    "raise 2.5bb",
    "call",
    "check",
    "bet 0.5pot",
    "call",
    "check",
    "bet 0.75pot",
    "call",
    "check",
    "all-in",
    "fold"
  ],
  "hero_action": "raise",
  "result": "SPLIT",
  "tags": [
    "BAD_BEAT",
    "CONTINUATION_BET",
    "HIGH_STAKES",
    "RIVER_DECISION",
    "BLUFF"
  ],
  "hand_type": "BLUFF",
  "video_url": "gs://poker-videos-prod/wsop_2024/day1_table2.mp4",
  "video_start_time": 7448.3,
  "video_end_time": 19574.3,
  "thumbnail_url": "gs://poker-videos-prod/thumbnails/wsop_2024_hand_0051.jpg",
  "ati_version": "1.0.0",
  "ati_confidence": 0.82
}