{
  "hand_id": "mpp_2024_hand_0039",
  "tournament_id": "mpp_2024",
  "hand_number": 39,
  "timestamp": "2024-11-15T00:00:00Z",
  "duration_seconds": 235,
  "description": "Phil Ivey makes a sick river call against Wesley Fei. Wesley Fei fires three barrels and shoves 129.8bb on the river. Phil Ivey thinks for 73s and calls with just trips. Wesley Fei was bluffing with two pair bluff and Phil Ivey scoops a 385.1bb pot.",
  "hero_name": "Phil Ivey",
  "villain_name": "Wesley Fei",
  "hero_position": "UTG",
  "villain_position": "UTG1",
  "hero_stack_bb": 239.7,
  "villain_stack_bb": 427.0,
  "street": "RIVER",
  "pot_bb": 385.1,
  "action_sequence": [
    "raise 3bb",
    "3bet 9bb",
    "call",
    "check",
    "bet 0.5pot",
    "call",
    "check",
    "bet 0.75pot",
    "call",
    "check",
    "all-in",
    "tank 240s",
    "call"
  ],
  "hero_action": "call",
  "result": "SPLIT",
  "tags": [
    "SICK_CALL",
    "BAD_BEAT",
    "HERO_CALL",
    "COOLER",
    "RIVER_DECISION",
    "CHECK_RAISE"
  ],
  "hand_type": "HERO_CALL",
  "video_url": "gs://poker-videos-prod/mpp_2024/day8_table10.mp4",
  "video_start_time": 9177.8,
  "video_end_time": 16236.8,
  "thumbnail_url": "gs://poker-videos-prod/thumbnails/mpp_2024_hand_0039.jpg",
  "ati_version": "1.0.0",
  "ati_confidence": 0.93
}