{
  "hand_id": "wsop_2023_hand_0015",
  "tournament_id": "wsop_2023",
  "hand_number": 15,
  "timestamp": "2024-10-14T00:00:00Z",
  "duration_seconds": 73,
  "description": "Justin Bonomo makes a sick preflop call against Tom Dwan. Tom Dwan fires three barrels and shoves 370.6bb on the preflop. Justin Bonomo thinks for 263s and calls with just ace-high. Tom Dwan was bluffing with trips bluff and Justin Bonomo scoops a 752.8bb pot.",
  "hero_name": "Justin Bonomo",
  "villain_name": "Tom Dwan",
  "hero_position": "MP",
  "villain_position": "CO",
  "hero_stack_bb": 67.4,
  "villain_stack_bb": 307.0,
  "street": "PREFLOP",
  "pot_bb": 752.8,
  "action_sequence": [
    "raise 2.5bb",
    "call",
    "check",
    "bet 0.33pot",
    "call",
    "check",
    "bet 0.5pot",
    "call",
    "check",
    "bet 0.8pot",
    "tank 180s",
    "call"
  ],
  "hero_action": "raise",
  "result": "LOSE",
  "tags": [
    "SICK_CALL",
    "CONTINUATION_BET",
    "RIVER_DECISION",
    "HERO_CALL"
  ],
  "hand_type": "HERO_CALL",
  "video_url": "gs://poker-videos-prod/wsop_2023/day10_table16.mp4",
  "video_start_time": 7048.0,
  "video_end_time": 17619.2,
  "thumbnail_url": "gs://poker-videos-prod/thumbnails/wsop_2023_hand_0015.jpg",
  "ati_version": "1.0.0",
  "ati_confidence": 0.83
}