{
  "hand_id": "mpp_2023_hand_0085",
  "tournament_id": "mpp_2023",
  "hand_number": 85,
  "timestamp": "2024-11-06T00:00:00Z",
  "duration_seconds": 243,
  "description": "Maria Ho makes an insane turn call with middle pair against Liv Boeree's value bet. After Liv Boeree bets 210.6bb into a 439.8bb pot on the turn, Maria Ho tanks for 114s and makes the hero call with middle pair. Liv Boeree shows top pair bluff and Maria Ho wins a massive 650.4bb pot.",
  "hero_name": "Maria Ho",
  "villain_name": "Liv Boeree",
  "hero_position": "BTN",
  "villain_position": "SB",
  "hero_stack_bb": 258.7,
  "villain_stack_bb": 328.3,
  "street": "TURN",
  "pot_bb": 650.4,
  "action_sequence": [
    "raise 3bb",
    "3bet 9bb",
    "call",
    "check",
    "bet 0.5pot",
    "call",
    "check",
    "bet 0.75pot",
    "call",
    "check",
    "all-in",
    "tank 240s",
    "call"
  ],
  "hero_action": "fold",
  "result": "LOSE",
  "tags": [
    "SICK_CALL",
    "HERO_CALL",
    "RIVER_DECISION",
    "SQUEEZE",
    "4BET",
    "CHECK_RAISE"
  ],
  "hand_type": "HERO_CALL",
  "video_url": "gs://poker-videos-prod/mpp_2023/day6_table7.mp4",
  "video_start_time": 7055.9,
  "video_end_time": 13349.1,
  "thumbnail_url": "gs://poker-videos-prod/thumbnails/mpp_2023_hand_0085.jpg",
  "ati_version": "1.0.0",
  "ati_confidence": 0.88
}