{
  "hand_id": "mpp_2024_hand_0058",
  "tournament_id": "mpp_2024",
  "hand_number": 58,
  "timestamp": "2024-11-10T00:00:00Z",
  "duration_seconds": 82,
  "description": "Massive all-in pot! Tom Dwan shoves 36.0bb with trips against Jason Koon's middle pair on the river. Jason Koon calls and Villain wins. Final pot: 56.2bb.",
  "hero_name": "Tom Dwan",
  "villain_name": "Jason Koon",
  "hero_position": "MP",
  "villain_position": "UTG",
  "hero_stack_bb": 460.8,
  "villain_stack_bb": 426.3,
  "street": "RIVER",
  "pot_bb": 56.2,
  "action_sequence": [
    "limp",
    "raise 5bb",
    "call",
    "check",
    "bet 0.5pot",
    "raise 2x",
    "all-in",
    "call"
  ],
  "hero_action": "call",
  "result": "LOSE",
  "tags": [
    "HIGH_STAKES",
    "BAD_BEAT",
    "TILT",
    "ALL_IN"
  ],
  "hand_type": "ALL_IN",
  "video_url": "gs://poker-videos-prod/mpp_2024/day4_table18.mp4",
  "video_start_time": 6138.2,
  "video_end_time": 16665.2,
  "thumbnail_url": "gs://poker-videos-prod/thumbnails/mpp_2024_hand_0058.jpg",
  "ati_version": "1.0.0",
  "ati_confidence": 0.9
}